{
  "id": "pixelandia",
  "title": "El Reino de Pixelandia",
  "logline": "La Gran Quietud congeló Pixelandia; cada carta del Mazo del Movimiento que juegas devuelve la vida a un rincón del reino.",
  "welcome": {
    "title": "El Reino de Pixelandia",
    "lines": [
      "La Gran Quietud congeló a Pixelandia: nadie se mueve, todo se apaga.",
      "Tú tienes el último Mazo del Movimiento. Cada carta que juegas devuelve la vida a un rincón del reino.",
      "Una carta. Un movimiento. ¡Listo!"
    ],
    "cta": "Comenzar la aventura",
    "note": "Historia provisional · el mundo final lo escribe storyteller."
  },
  "signin": {
    "title": "Crea tu héroe",
    "body": "Entra con tu cuenta de Google para guardar tu mazo, tu nivel y tus logros, y recuperarlos en cualquier teléfono.",
    "offline": "Después del primer inicio de sesión, SnapFit funciona también <b>sin internet</b>."
  },
  "deckReady": {
    "title": "Tu mazo está listo"
  },
  "guide": {
    "name": "Bit",
    "role": "Mapache mensajero y narrador"
  },
  "families": {
    "piernas": {
      "name": "Piernas",
      "icon": "🦵"
    },
    "gluteos": {
      "name": "Glúteos",
      "icon": "🍑"
    },
    "empuje": {
      "name": "Empuje",
      "icon": "✋"
    },
    "traccion": {
      "name": "Tracción",
      "icon": "🪢"
    },
    "core": {
      "name": "Core",
      "icon": "🛡️"
    },
    "movilidad": {
      "name": "Movilidad",
      "icon": "🌀"
    },
    "cardio": {
      "name": "Cardio",
      "icon": "❤️"
    }
  },
  "tiers": {
    "1": "Bronce",
    "2": "Plata",
    "3": "Oro",
    "4": "Leyenda"
  },
  "regions": {
    "1": "Aldea",
    "2": "Molinos",
    "3": "Bosque",
    "4": "Puerto",
    "5": "Montaña",
    "6": "Desierto",
    "7": "Lago",
    "8": "Volcán",
    "9": "Nubes",
    "10": "Castillo"
  },
  "rewards": [
    "¡Snap!",
    "¡Combo!",
    "¡Bien jugado!",
    "¡Nivel en marcha!",
    "¡Carta ganada!",
    "¡Eso es!",
    "¡Power up!"
  ],
  "reminders": [
    "Tu mazo te espera: una carta y listo.",
    "¿Un Snap rápido? Menos de 2 minutos.",
    "Ronda bonus: una carta para moverte."
  ],
  "badges": {
    "first-card": {
      "name": "Primer Snap",
      "desc": "Completa tu primera carta"
    },
    "daily-goal-1": {
      "name": "Mazo Completo",
      "desc": "Cumple tu meta diaria por primera vez"
    },
    "streak-3": {
      "name": "Racha de Bronce",
      "desc": "3 días seguidos"
    },
    "streak-7": {
      "name": "Racha de Plata",
      "desc": "7 días seguidos"
    },
    "streak-30": {
      "name": "Racha de Oro",
      "desc": "30 días seguidos"
    },
    "cards-50": {
      "name": "Coleccionista I",
      "desc": "50 cartas completadas"
    },
    "cards-250": {
      "name": "Coleccionista II",
      "desc": "250 cartas completadas"
    },
    "cards-1000": {
      "name": "Coleccionista III",
      "desc": "1000 cartas completadas"
    },
    "full-body-week": {
      "name": "Cuerpo Completo",
      "desc": "Todos los grupos en 7 días"
    },
    "level-up-piernas": {
      "name": "Subida: Piernas",
      "desc": "Sube de nivel en Piernas"
    },
    "level-up-gluteos": {
      "name": "Subida: Glúteos",
      "desc": "Sube de nivel en Glúteos"
    },
    "level-up-empuje": {
      "name": "Subida: Empuje",
      "desc": "Sube de nivel en Empuje"
    },
    "level-up-traccion": {
      "name": "Subida: Tracción",
      "desc": "Sube de nivel en Tracción"
    },
    "level-up-core": {
      "name": "Subida: Core",
      "desc": "Sube de nivel en Core"
    },
    "level-up-movilidad": {
      "name": "Subida: Movilidad",
      "desc": "Sube de nivel en Movilidad"
    },
    "level-up-cardio": {
      "name": "Subida: Cardio",
      "desc": "Sube de nivel en Cardio"
    },
    "level-5": {
      "name": "Jefe de Nivel",
      "desc": "Nivel global 5"
    },
    "level-10": {
      "name": "Leyenda Pixel",
      "desc": "Nivel global 10"
    },
    "early-bird": {
      "name": "Gallo Madrugador",
      "desc": "Una carta antes de las 8:00"
    },
    "night-owl": {
      "name": "Búho Arcade",
      "desc": "Una carta después de las 21:00"
    },
    "park-explorer": {
      "name": "Explorador del Parque",
      "desc": "10 cartas en el parque"
    },
    "comeback": {
      "name": "El Regreso",
      "desc": "Vuelve tras 7 días o más"
    }
  }
}
